{
  "$schema": "http://json-schema.org/draft-07/schema#",
  "$id": "dc-match-recommendation-v1.schema.json",
  "title": "Match Recommendation Contract (DC-MATCH-RECOMMENDATION-v1)",
  "description": "Ranked top-N candidate Stations per Encounter, advisory only (Sprint 07).",
  "type": "object",
  "additionalProperties": false,
  "required": [
    "datasetId", "contractId", "contractVersion",
    "classification", "residency", "purposeTags", "records"
  ],
  "properties": {
    "datasetId":        { "type": "string", "pattern": "^DS-MATCH-REC-[a-z0-9-]+$" },
    "contractId":       { "type": "string", "enum": ["DC-MATCH-RECOMMENDATION-v1"] },
    "contractVersion":  { "type": "string", "pattern": "^[0-9]+\\.[0-9]+\\.[0-9]+$" },
    "classification":   { "type": "string", "enum": ["operational-confidential"] },
    "residency":        { "type": "string", "enum": ["CH"] },
    "purposeTags": {
      "type": "array",
      "minItems": 1,
      "items": { "type": "string", "enum": ["capacity-planning", "bed-management"] }
    },
    "records": {
      "type": "array",
      "minItems": 1,
      "items": {
        "type": "object",
        "additionalProperties": false,
        "required": [
          "contractId", "recommendationId", "encounterId", "organizationId",
          "generatedAt", "validUntil", "algorithmId", "algorithmVersion",
          "status", "dataResidencyRegion", "inputSnapshot", "candidates"
        ],
        "properties": {
          "contractId":          { "type": "string", "enum": ["DC-MATCH-RECOMMENDATION-v1"] },
          "recommendationId":    { "type": "string", "pattern": "^REC-[0-9TZ:.-]+-ENC-[0-9-]+$" },
          "encounterId":         { "type": "string", "pattern": "^ENC-[0-9]{4}-[0-9]{4,}$" },
          "organizationId":      { "type": "string", "pattern": "^ORG-[A-Z0-9-]+$" },
          "generatedAt":         { "type": "string", "format": "date-time" },
          "validUntil":          { "type": "string", "format": "date-time" },
          "algorithmId":         { "type": "string", "pattern": "^[a-z][a-z0-9-]+$" },
          "algorithmVersion":    { "type": "string", "pattern": "^[0-9]+\\.[0-9]+\\.[0-9]+$" },
          "status":              { "type": "string", "enum": ["advisory"] },
          "dataResidencyRegion": { "type": "string", "enum": ["switzerlandnorth", "switzerlandwest"] },
          "inputSnapshot": {
            "type": "object",
            "additionalProperties": false,
            "required": ["encounterAsOf", "supplyAsOf", "consideredStationIds"],
            "properties": {
              "encounterAsOf":         { "type": "string", "format": "date-time" },
              "supplyAsOf":            { "type": "string", "format": "date-time" },
              "consideredStationIds":  { "type": "array", "items": { "type": "string", "pattern": "^LOC-[A-Z0-9-]+$" } },
              "excludedStationIds": {
                "type": "array",
                "items": {
                  "type": "object",
                  "additionalProperties": false,
                  "required": ["stationId", "reason"],
                  "properties": {
                    "stationId": { "type": "string", "pattern": "^LOC-[A-Z0-9-]+$" },
                    "reason":    { "type": "string", "enum": [
                      "specialty-mismatch", "hard-characteristic-missing",
                      "capacity-zero", "ward-suspended", "ward-inactive"
                    ]}
                  }
                }
              }
            }
          },
          "candidates": {
            "type": "array",
            "minItems": 1,
            "maxItems": 5,
            "items": {
              "type": "object",
              "additionalProperties": false,
              "required": [
                "rank", "stationLocationId", "recommendedBedLocationId",
                "fitScore", "capacityHeadroom",
                "expectedAdmitWindowStart", "expectedAdmitWindowEnd",
                "explanationFactors", "hardConstraintsMet"
              ],
              "properties": {
                "rank":                     { "type": "integer", "minimum": 1, "maximum": 5 },
                "stationLocationId":        { "type": "string", "pattern": "^LOC-[A-Z0-9-]+$" },
                "recommendedBedLocationId": { "type": ["string", "null"], "pattern": "^LOC-[A-Z0-9-]+$" },
                "fitScore":                 { "type": "number", "minimum": 0, "maximum": 1 },
                "capacityHeadroom":         { "type": "integer", "minimum": 0, "maximum": 2000 },
                "expectedAdmitWindowStart": { "type": "string", "format": "date-time" },
                "expectedAdmitWindowEnd":   { "type": "string", "format": "date-time" },
                "explanationFactors": {
                  "type": "array",
                  "minItems": 1,
                  "items": {
                    "type": "object",
                    "additionalProperties": false,
                    "required": ["factor", "weight"],
                    "properties": {
                      "factor":   { "type": "string", "enum": [
                        "specialty-match", "capacity-headroom",
                        "characteristic-match", "admit-window-fit",
                        "acuity-fit", "partial-characteristic-match"
                      ]},
                      "weight":   { "type": "number", "minimum": 0, "maximum": 1 },
                      "evidence": { "type": "string" }
                    }
                  }
                },
                "bedFitFactors": {
                  "type": "array",
                  "items": { "type": "string", "enum": [
                    "single-room-available", "isolation-capable",
                    "monitoring-equipped", "bariatric-equipped",
                    "last-cleaned-within-2h", "gender-constraint-met"
                  ]}
                },
                "hardConstraintsMet": { "type": "boolean" },
                "softConstraintGaps": { "type": "array", "items": { "type": "string" } }
              }
            }
          },
          "extensions": { "type": "object" }
        }
      }
    }
  }
}
