{
  "datasetId": "DS-MATCH-REC-sit-2026-06-12",
  "contractId": "DC-MATCH-RECOMMENDATION-v1",
  "contractVersion": "1.0.0",
  "classification": "operational-confidential",
  "residency": "CH",
  "records": [
    {
      "contractId": "DC-MATCH-RECOMMENDATION-v1",
      "recommendationId": "REC-2026-06-12T08:00:00Z-ENC-2026-0001",
      "encounterId": "ENC-2026-0001",
      "organizationId": "ORG-HIRSLANDEN",
      "generatedAt": "2026-06-12T08:00:00Z",
      "validUntil": "2026-06-12T08:30:00Z",
      "algorithmId": "stub-rules-v1",
      "algorithmVersion": "1.0.0",
      "status": "advisory",
      "dataResidencyRegion": "switzerlandnorth",
      "inputSnapshot": {
        "encounterAsOf": "2026-06-12T08:00:00Z",
        "supplyAsOf": "2026-06-12T08:00:00Z",
        "consideredStationIds": [
          "LOC-HIRSL-WARD-0205"
        ]
      },
      "candidates": [
        {
          "rank": 1,
          "stationLocationId": "LOC-HIRSL-WARD-0205",
          "recommendedBedLocationId": "LOC-HIRSL-BED-0205006",
          "fitScore": 0.925,
          "capacityHeadroom": 9,
          "expectedAdmitWindowStart": "2026-06-19T08:37:00Z",
          "expectedAdmitWindowEnd": "2026-06-19T14:37:00Z",
          "explanationFactors": [
            {
              "factor": "specialty-match",
              "weight": 0.5405
            },
            {
              "factor": "capacity-headroom",
              "weight": 0.2432
            },
            {
              "factor": "characteristic-match",
              "weight": 0.2162
            }
          ],
          "hardConstraintsMet": true,
          "bedFitFactors": [
            "single-room-available",
            "isolation-capable"
          ]
        }
      ]
    },
    {
      "contractId": "DC-MATCH-RECOMMENDATION-v1",
      "recommendationId": "REC-2026-06-12T08:00:00Z-ENC-2026-0002",
      "encounterId": "ENC-2026-0002",
      "organizationId": "ORG-HIRSLANDEN",
      "generatedAt": "2026-06-12T08:00:00Z",
      "validUntil": "2026-06-12T08:30:00Z",
      "algorithmId": "stub-rules-v1",
      "algorithmVersion": "1.0.0",
      "status": "advisory",
      "dataResidencyRegion": "switzerlandnorth",
      "inputSnapshot": {
        "encounterAsOf": "2026-06-12T08:00:00Z",
        "supplyAsOf": "2026-06-12T08:00:00Z",
        "consideredStationIds": [
          "LOC-HIRSL-WARD-0106"
        ]
      },
      "candidates": [
        {
          "rank": 1,
          "stationLocationId": "LOC-HIRSL-WARD-0106",
          "recommendedBedLocationId": "LOC-HIRSL-BED-0106001",
          "fitScore": 0.775,
          "capacityHeadroom": 3,
          "expectedAdmitWindowStart": "2026-06-23T07:42:00Z",
          "expectedAdmitWindowEnd": "2026-06-23T13:42:00Z",
          "explanationFactors": [
            {
              "factor": "specialty-match",
              "weight": 0.6452
            },
            {
              "factor": "capacity-headroom",
              "weight": 0.0968
            },
            {
              "factor": "characteristic-match",
              "weight": 0.2581
            }
          ],
          "hardConstraintsMet": true,
          "bedFitFactors": [
            "single-room-available"
          ]
        }
      ]
    },
    {
      "contractId": "DC-MATCH-RECOMMENDATION-v1",
      "recommendationId": "REC-2026-06-12T08:00:00Z-ENC-2026-0003",
      "encounterId": "ENC-2026-0003",
      "organizationId": "ORG-HIRSLANDEN",
      "generatedAt": "2026-06-12T08:00:00Z",
      "validUntil": "2026-06-12T08:30:00Z",
      "algorithmId": "stub-rules-v1",
      "algorithmVersion": "1.0.0",
      "status": "advisory",
      "dataResidencyRegion": "switzerlandnorth",
      "inputSnapshot": {
        "encounterAsOf": "2026-06-12T08:00:00Z",
        "supplyAsOf": "2026-06-12T08:00:00Z",
        "consideredStationIds": [
          "LOC-HIRSL-WARD-0101"
        ]
      },
      "candidates": [
        {
          "rank": 1,
          "stationLocationId": "LOC-HIRSL-WARD-0101",
          "recommendedBedLocationId": "LOC-HIRSL-BED-0101002",
          "fitScore": 0.7,
          "capacityHeadroom": 0,
          "expectedAdmitWindowStart": "2026-06-25T07:45:00Z",
          "expectedAdmitWindowEnd": "2026-06-25T13:45:00Z",
          "explanationFactors": [
            {
              "factor": "specialty-match",
              "weight": 0.7143
            },
            {
              "factor": "capacity-headroom",
              "weight": 0.0
            },
            {
              "factor": "characteristic-match",
              "weight": 0.2857
            }
          ],
          "hardConstraintsMet": true,
          "bedFitFactors": [
            "isolation-capable"
          ]
        }
      ]
    },
    {
      "contractId": "DC-MATCH-RECOMMENDATION-v1",
      "recommendationId": "REC-2026-06-12T08:00:00Z-ENC-2026-0004",
      "encounterId": "ENC-2026-0004",
      "organizationId": "ORG-ZOLLIKERBERG",
      "generatedAt": "2026-06-12T08:00:00Z",
      "validUntil": "2026-06-12T08:30:00Z",
      "algorithmId": "stub-rules-v1",
      "algorithmVersion": "1.0.0",
      "status": "advisory",
      "dataResidencyRegion": "switzerlandnorth",
      "inputSnapshot": {
        "encounterAsOf": "2026-06-12T08:00:00Z",
        "supplyAsOf": "2026-06-12T08:00:00Z",
        "consideredStationIds": [
          "LOC-ZOLLI-WARD-0203"
        ]
      },
      "candidates": [
        {
          "rank": 1,
          "stationLocationId": "LOC-ZOLLI-WARD-0203",
          "recommendedBedLocationId": "LOC-ZOLLI-BED-0203003",
          "fitScore": 0.8,
          "capacityHeadroom": 4,
          "expectedAdmitWindowStart": "2026-06-23T12:56:00Z",
          "expectedAdmitWindowEnd": "2026-06-23T18:56:00Z",
          "explanationFactors": [
            {
              "factor": "specialty-match",
              "weight": 0.625
            },
            {
              "factor": "capacity-headroom",
              "weight": 0.125
            },
            {
              "factor": "characteristic-match",
              "weight": 0.25
            }
          ],
          "hardConstraintsMet": true,
          "bedFitFactors": [
            "single-room-available",
            "bariatric-equipped"
          ]
        }
      ]
    },
    {
      "contractId": "DC-MATCH-RECOMMENDATION-v1",
      "recommendationId": "REC-2026-06-12T08:00:00Z-ENC-2026-0005",
      "encounterId": "ENC-2026-0005",
      "organizationId": "ORG-HIRSLANDEN",
      "generatedAt": "2026-06-12T08:00:00Z",
      "validUntil": "2026-06-12T08:30:00Z",
      "algorithmId": "stub-rules-v1",
      "algorithmVersion": "1.0.0",
      "status": "advisory",
      "dataResidencyRegion": "switzerlandnorth",
      "inputSnapshot": {
        "encounterAsOf": "2026-06-12T08:00:00Z",
        "supplyAsOf": "2026-06-12T08:00:00Z",
        "consideredStationIds": [
          "LOC-HIRSL-WARD-0106"
        ]
      },
      "candidates": [
        {
          "rank": 1,
          "stationLocationId": "LOC-HIRSL-WARD-0106",
          "recommendedBedLocationId": "LOC-HIRSL-BED-0106001",
          "fitScore": 0.775,
          "capacityHeadroom": 3,
          "expectedAdmitWindowStart": "2026-06-16T04:48:00Z",
          "expectedAdmitWindowEnd": "2026-06-16T10:48:00Z",
          "explanationFactors": [
            {
              "factor": "specialty-match",
              "weight": 0.6452
            },
            {
              "factor": "capacity-headroom",
              "weight": 0.0968
            },
            {
              "factor": "characteristic-match",
              "weight": 0.2581
            }
          ],
          "hardConstraintsMet": true,
          "bedFitFactors": [
            "single-room-available"
          ]
        }
      ]
    },
    {
      "contractId": "DC-MATCH-RECOMMENDATION-v1",
      "recommendationId": "REC-2026-06-12T08:00:00Z-ENC-2026-0006",
      "encounterId": "ENC-2026-0006",
      "organizationId": "ORG-ZOLLIKERBERG",
      "generatedAt": "2026-06-12T08:00:00Z",
      "validUntil": "2026-06-12T08:30:00Z",
      "algorithmId": "stub-rules-v1",
      "algorithmVersion": "1.0.0",
      "status": "advisory",
      "dataResidencyRegion": "switzerlandnorth",
      "inputSnapshot": {
        "encounterAsOf": "2026-06-12T08:00:00Z",
        "supplyAsOf": "2026-06-12T08:00:00Z",
        "consideredStationIds": [
          "LOC-ZOLLI-WARD-0206"
        ]
      },
      "candidates": [
        {
          "rank": 1,
          "stationLocationId": "LOC-ZOLLI-WARD-0206",
          "recommendedBedLocationId": "LOC-ZOLLI-BED-0206003",
          "fitScore": 0.8,
          "capacityHeadroom": 4,
          "expectedAdmitWindowStart": "2026-06-15T23:33:00Z",
          "expectedAdmitWindowEnd": "2026-06-16T05:33:00Z",
          "explanationFactors": [
            {
              "factor": "specialty-match",
              "weight": 0.625
            },
            {
              "factor": "capacity-headroom",
              "weight": 0.125
            },
            {
              "factor": "characteristic-match",
              "weight": 0.25
            }
          ],
          "hardConstraintsMet": true,
          "bedFitFactors": [
            "monitoring-equipped"
          ]
        }
      ]
    },
    {
      "contractId": "DC-MATCH-RECOMMENDATION-v1",
      "recommendationId": "REC-2026-06-12T08:00:00Z-ENC-2026-0007",
      "encounterId": "ENC-2026-0007",
      "organizationId": "ORG-HIRSLANDEN",
      "generatedAt": "2026-06-12T08:00:00Z",
      "validUntil": "2026-06-12T08:30:00Z",
      "algorithmId": "stub-rules-v1",
      "algorithmVersion": "1.0.0",
      "status": "advisory",
      "dataResidencyRegion": "switzerlandnorth",
      "inputSnapshot": {
        "encounterAsOf": "2026-06-12T08:00:00Z",
        "supplyAsOf": "2026-06-12T08:00:00Z",
        "consideredStationIds": [
          "LOC-HIRSL-WARD-0101"
        ]
      },
      "candidates": [
        {
          "rank": 1,